{"$schema":"https://json-schema.org/draft/2020-12/schema","$id":"https://prismtek.dev/schemas/buddy-creation-options.schema.json","title":"BuddyCreationOptionsV1","type":"object","required":["version","defaults","freeformFields","options","selectionRules","starterLoadoutRules"],"properties":{"version":{"type":"string"},"description":{"type":"string"},"defaults":{"type":"object"},"freeformFields":{"type":"object"},"options":{"type":"object"},"selectionRules":{"type":"object"},"compatibilityRules":{"type":"array"},"starterLoadoutRules":{"type":"object"},"recommendationQuiz":{"type":"object"}},"additionalProperties":false}