{"version":"1.0.0","description":"Deterministic Buddy creation options for onboarding and custom Buddy generation. Use dropdowns/cards first, freeform only where explicitly allowed.","defaults":{"purpose":"daily_life","personalityPrimary":"cheerful","voicePrimary":"friendly","archetype":"console_pet","bodyStyle":"round","palette":"mint_cream","jobClass":"companion","activityMode":"balanced","evolutionStage":1,"asciiVariant":"starter_a","pixelVariant":null},"freeformFields":{"name":{"enabled":true,"required":true,"minLength":1,"maxLength":24,"pattern":"^[A-Za-z0-9 _'\\-]+$"},"nickname":{"enabled":true,"required":false,"minLength":1,"maxLength":24,"pattern":"^[A-Za-z0-9 _'\\-]+$"},"catchphrase":{"enabled":false,"required":false},"customNotes":{"enabled":false,"required":false}},"options":{"purposes":[{"id":"daily_life","label":"Daily life","description":"General everyday help, routines, reminders, and check-ins."},{"id":"planning","label":"Planning and organization","description":"Tasks, priorities, schedules, and structure."},{"id":"creative","label":"Creative partner","description":"Ideas, naming, drafts, polish, and concepting."},{"id":"coding","label":"Coding and building","description":"Implementation, debugging, and execution."},{"id":"research","label":"Research and learning","description":"Exploration, comparison, notes, and study."},{"id":"wellness","label":"Wellness and routines","description":"Habits, encouragement, and personal momentum."},{"id":"business","label":"Business and operations","description":"Processes, systems, planning, and admin."},{"id":"communication","label":"Social and communication","description":"Drafting, tone, support, and conversations."}],"personalities":[{"id":"cheerful","label":"Cheerful"},{"id":"calm","label":"Calm"},{"id":"focused","label":"Focused"},{"id":"wise","label":"Wise"},{"id":"playful","label":"Playful"},{"id":"loyal","label":"Loyal"},{"id":"energetic","label":"Energetic"},{"id":"protective","label":"Protective"},{"id":"curious","label":"Curious"},{"id":"gentle","label":"Gentle"}],"voices":[{"id":"friendly","label":"Friendly"},{"id":"soft","label":"Soft"},{"id":"confident","label":"Confident"},{"id":"professional","label":"Professional"},{"id":"quirky","label":"Quirky"},{"id":"cozy","label":"Cozy"},{"id":"direct","label":"Direct"},{"id":"uplifting","label":"Uplifting"},{"id":"smart","label":"Smart"},{"id":"mischievous","label":"Mischievous"}],"archetypes":[{"id":"console_pet","label":"Console pet","family":"machine"},{"id":"cat_like","label":"Cat-like","family":"animal"},{"id":"robot","label":"Robot","family":"machine"},{"id":"slime","label":"Slime","family":"creature"},{"id":"spirit","label":"Spirit","family":"fantasy"},{"id":"tiny_monster","label":"Tiny monster","family":"creature"},{"id":"companion_orb","label":"Companion orb","family":"abstract"},{"id":"plant_creature","label":"Plant creature","family":"nature"},{"id":"mini_wizard","label":"Mini wizard","family":"fantasy"},{"id":"dino","label":"Dino","family":"animal"},{"id":"fox_like","label":"Fox-like","family":"animal"},{"id":"pixel_pet","label":"Pixel pet","family":"retro"}],"bodyStyles":[{"id":"tiny","label":"Tiny"},{"id":"round","label":"Round"},{"id":"tall","label":"Tall"},{"id":"chubby","label":"Chubby"},{"id":"compact","label":"Compact"},{"id":"floaty","label":"Floaty"},{"id":"squishy","label":"Squishy"},{"id":"mechanical","label":"Mechanical"},{"id":"soft","label":"Soft"},{"id":"angular","label":"Angular"}],"palettes":[{"id":"mint_cream","label":"Mint + cream","colors":["#8FD9C8","#FFF8E7","#2B7A78","#17252A"]},{"id":"rose_white","label":"Rose + white","colors":["#F28CB1","#FFF5FA","#B8336A","#6B2447"]},{"id":"lavender_sky","label":"Lavender + sky","colors":["#B8A1FF","#DFF4FF","#5E60CE","#2F3E8F"]},{"id":"sky_navy","label":"Sky + navy","colors":["#7CC6FE","#D9F0FF","#1D3557","#89C2D9"]},{"id":"aqua_teal","label":"Aqua + teal","colors":["#72F1E8","#C8FFF4","#008080","#114B5F"]},{"id":"aurora_ice","label":"Aurora ice","colors":["#B8FFF9","#E7FBFF","#65D6CE","#3A506B"]},{"id":"peach_brown","label":"Peach + brown","colors":["#FFC6A5","#FFF1E6","#B5654A","#7A5230"]},{"id":"yellow_cocoa","label":"Yellow + cocoa","colors":["#F4D35E","#FFF6CC","#B08900","#6F4E37"]},{"id":"sunset_pop","label":"Sunset pop","colors":["#FF9E7A","#FFD6A5","#E76F51","#6D597A"]},{"id":"forest_moss","label":"Forest + moss","colors":["#2F6B3D","#8BAE5A","#D8F3DC","#344E41"]},{"id":"moss_ember","label":"Moss + ember","colors":["#718355","#E9EDC9","#BC6C25","#6C584C"]},{"id":"petal_leaf","label":"Petal + leaf","colors":["#F7CAD0","#FAE1DD","#84A98C","#52796F"]},{"id":"purple_gold","label":"Purple + gold","colors":["#8D6BFF","#E6C15A","#3C096C","#FFD166"]},{"id":"ember_lilac","label":"Ember + lilac","colors":["#FF9770","#FFD670","#C77DFF","#6A4C93"]},{"id":"midnight_gold","label":"Midnight gold","colors":["#1B263B","#415A77","#E0A458","#F4F1DE"]},{"id":"black_neon","label":"Black + neon","colors":["#111111","#39FF88","#00E5FF","#F5F749"]},{"id":"red_charcoal","label":"Red + charcoal","colors":["#D1495B","#2B2D42","#F2CC8F","#8D99AE"]},{"id":"plasma_wave","label":"Plasma wave","colors":["#FF006E","#8338EC","#3A86FF","#0B132B"]},{"id":"candy_burst","label":"Candy burst","colors":["#FF8FAB","#FFC6FF","#BDE0FE","#A2D2FF"]},{"id":"berry_soda","label":"Berry soda","colors":["#9B5DE5","#F15BB5","#FEE440","#00BBF9"]},{"id":"pixel_party","label":"Pixel party","colors":["#43AA8B","#577590","#F94144","#F9C74F"]}],"jobClasses":[{"id":"planner","label":"Planner","primaryTraining":"planning","secondaryTraining":"organization"},{"id":"helper","label":"Helper","primaryTraining":"emotional_support","secondaryTraining":"organization"},{"id":"researcher","label":"Researcher","primaryTraining":"research","secondaryTraining":"memory"},{"id":"builder","label":"Builder","primaryTraining":"building","secondaryTraining":"planning"},{"id":"artist","label":"Artist","primaryTraining":"creativity","secondaryTraining":"writing"},{"id":"archivist","label":"Archivist","primaryTraining":"memory","secondaryTraining":"research"},{"id":"coach","label":"Coach","primaryTraining":"emotional_support","secondaryTraining":"planning"},{"id":"operator","label":"Operator","primaryTraining":"coordination","secondaryTraining":"planning"},{"id":"writer","label":"Writer","primaryTraining":"writing","secondaryTraining":"creativity"},{"id":"scout","label":"Scout","primaryTraining":"research","secondaryTraining":"optimization"},{"id":"organizer","label":"Organizer","primaryTraining":"organization","secondaryTraining":"planning"},{"id":"strategist","label":"Strategist","primaryTraining":"planning","secondaryTraining":"coordination"},{"id":"companion","label":"Companion","primaryTraining":"emotional_support","secondaryTraining":"memory"}],"activityModes":[{"id":"chill","label":"Chill","suggestionFrequency":"low"},{"id":"balanced","label":"Balanced","suggestionFrequency":"medium"},{"id":"proactive","label":"Proactive","suggestionFrequency":"high"}],"moods":[{"id":"neutral","label":"Neutral"},{"id":"happy","label":"Happy"},{"id":"thinking","label":"Thinking"},{"id":"working","label":"Working"},{"id":"sleepy","label":"Sleepy"},{"id":"excited","label":"Excited"}],"pixelGeneration":{"canvasPresets":[{"id":"px64","size":"64x64"},{"id":"px96","size":"96x96"},{"id":"px128","size":"128x128"}],"defaultCanvas":"px96","transparentBackground":true,"style":"cute_tamagotchi_pixel_pet","hardRules":["single centered character","full body visible","transparent background","no scenery","no text","no watermarks","clean readable silhouette","limited palette feel","one character only"]}},"selectionRules":{"personalityPrimaryCount":1,"personalitySecondaryCount":1,"voicePrimaryCount":1,"voiceSecondaryCount":1,"allowDuplicatePrimarySecondary":false,"freeformOnlyFor":["name","nickname"],"defaultPresetCount":12,"useGuidedSelectionsFirst":true},"compatibilityRules":[{"if":{"archetype":"console_pet"},"preferredBodyStyles":["compact","round","mechanical"]},{"if":{"archetype":"robot"},"preferredBodyStyles":["mechanical","compact","angular"]},{"if":{"archetype":"slime"},"preferredBodyStyles":["squishy","round","chubby"]},{"if":{"archetype":"companion_orb"},"preferredBodyStyles":["floaty","round","compact"]},{"if":{"archetype":"plant_creature"},"preferredBodyStyles":["soft","round","compact"]},{"if":{"jobClass":"archivist"},"suggestedPalettes":["sky_navy","purple_gold","forest_moss"]},{"if":{"jobClass":"builder"},"suggestedPalettes":["black_neon","sky_navy","red_charcoal"]},{"if":{"jobClass":"companion"},"suggestedPalettes":["mint_cream","rose_white","yellow_cocoa"]}],"starterLoadoutRules":{"statsStrategy":"job_class_bias_plus_personality_modifiers","startingMoveCount":4,"moveComposition":{"signature":1,"utility":2,"universal":1},"startingBond":0,"startingLevel":1,"startingEvolutionStage":1},"recommendationQuiz":{"promptSet":[{"id":"goal","question":"What do you want the most help with?","answers":[{"id":"everyday","label":"Everyday life"},{"id":"planning","label":"Planning"},{"id":"creating","label":"Creating"},{"id":"building","label":"Building"},{"id":"remembering","label":"Remembering"},{"id":"safety","label":"Careful review"}]},{"id":"energy","question":"What kind of energy feels best?","answers":[{"id":"calm","label":"Calm"},{"id":"playful","label":"Playful"},{"id":"direct","label":"Direct"},{"id":"cozy","label":"Cozy"}]}]}}
